Welcome to the PayRoll_Service Database.

/*
 *Created PayRoll_Service database.
 */

mysql> create database PayRoll_Services;
Query OK, 1 row affected (0.01 sec)

mysql> show databases;
+-----------------------+
| Database              |
+-----------------------+
| address_book_services |
| company_info          |
| information_schema    |
| mobile_info           |
| mysql                 |
| payroll_services      |
| performance_schema    |
| salary_info           |
| student_info          |
| sys                   |
+-----------------------+
10 rows in set (0.00 sec)

mysql> use payroll_services;
Database changed
mysql> select database();
+------------------+
| database()       |
+------------------+
| payroll_services |
+------------------+
1 row in set (0.00 sec)

/*
 *Created Employee_payRoll Table.
 */

mysql> create table employee_PayRoll(Id int not null auto_increment,
    -> Name Varchar(50) not null,
    -> Salary Double not null,
    -> StartDate date not null,
    -> primary key(id)
    -> );
Query OK, 0 rows affected (0.02 sec)

mysql> desc employee_PayRoll;
+-----------+-------------+------+-----+---------+----------------+
| Field     | Type        | Null | Key | Default | Extra          |
+-----------+-------------+------+-----+---------+----------------+
| Id        | int         | NO   | PRI | NULL    | auto_increment |
| Name      | varchar(50) | NO   |     | NULL    |                |
| Salary    | double      | NO   |     | NULL    |                |
| StartDate | date        | NO   |     | NULL    |                |
+-----------+-------------+------+-----+---------+----------------+
4 rows in set (0.01 sec)

/*
 *Inserted Values to the Employee_payroll Table.
 */

mysql> insert into employee_payroll (name,salary,startdate)
    -> values('Bill',1000000.00,'2018-01-03'),
    -> ('Terisa',2000000.00,'2019-11-13'),
    -> ('Charlie',3000000.00,'2020-05-21');
Query OK, 3 rows affected (0.01 sec)
Records: 3  Duplicates: 0  Warnings: 0

/*
 *Retrive Values to the Employee_payroll Table.
 */

mysql> select * from employee_payroll;
+----+---------+---------+------------+
| Id | Name    | Salary  | StartDate  |
+----+---------+---------+------------+
|  1 | Bill    | 1000000 | 2018-01-03 |
|  2 | Terisa  | 2000000 | 2019-11-13 |
|  3 | Charlie | 3000000 | 2020-05-21 |
+----+---------+---------+------------+
3 rows in set (0.00 sec)

/*
 *Finding salary for specific person.
 */

mysql> select salary from employee_Payroll where name="Bill";
+---------+
| salary  |
+---------+
| 1000000 |
+---------+
1 row in set (0.02 sec)

/*
 *cast() is used to convert string into date (string->'2018-01-01' convert to date)
 *now() is used find till today's date
 */

mysql> select * from Employee_Payroll
    -> where startdate between cast('2018-01-01' as date)
    -> and date(now());
+----+---------+---------+------------+
| id | name    | salary  | startdate  |
+----+---------+---------+------------+
|  1 | Bill    | 1000000 | 2018-01-03 |
|  2 | Terisa  | 2000000 | 2019-11-13 |
|  3 | Charlie | 3000000 | 2020-05-21 |
+----+---------+---------+------------+
3 rows in set (0.00 sec)

/*
 *created New column and update the data
 */

mysql> alter table employee_payroll add gender char(1) after name;
Query OK, 0 rows affected (0.04 sec)
Records: 0  Duplicates: 0  Warnings: 0

mysql> desc employee_payroll;
+-----------+-------------+------+-----+---------+----------------+
| Field     | Type        | Null | Key | Default | Extra          |
+-----------+-------------+------+-----+---------+----------------+
| id        | int         | NO   | PRI | NULL    | auto_increment |
| name      | varchar(50) | NO   |     | NULL    |                |
| gender    | char(1)     | YES  |     | NULL    |                |
| salary    | double      | NO   |     | NULL    |                |
| startdate | date        | NO   |     | NULL    |                |
+-----------+-------------+------+-----+---------+----------------+
5 rows in set (0.01 sec)

mysql>  update employee_payroll set gender='f' where name ="Terisa";
Query OK, 1 row affected (0.01 sec)
Rows matched: 1  Changed: 1  Warnings: 0

mysql> select * from employee_payroll;
+----+---------+--------+---------+------------+
| id | name    | gender | salary  | startdate  |
+----+---------+--------+---------+------------+
|  1 | Bill    | NULL   | 1000000 | 2018-01-03 |
|  2 | Terisa  | f      | 2000000 | 2019-11-13 |
|  3 | Charlie | NULL   | 3000000 | 2020-05-21 |
+----+---------+--------+---------+------------+
3 rows in set (0.00 sec)

mysql>  update employee_payroll set gender='m' where name ="Bill" or name ="Charlie";
Query OK, 2 rows affected (0.01 sec)
Rows matched: 2  Changed: 2  Warnings: 0

mysql> select * from employee_payroll;
+----+---------+--------+---------+------------+
| id | name    | gender | salary  | startdate  |
+----+---------+--------+---------+------------+
|  1 | Bill    | m      | 1000000 | 2018-01-03 |
|  2 | Terisa  | f      | 2000000 | 2019-11-13 |
|  3 | Charlie | m      | 3000000 | 2020-05-21 |
+----+---------+--------+---------+------------+
3 rows in set (0.00 sec)

mysql>  update employee_payroll set salary = 3000000.00 where name ="Terisa";
Query OK, 1 row affected (0.00 sec)
Rows matched: 1  Changed: 1  Warnings: 0

mysql> select * from employee_payroll;
+----+---------+--------+---------+------------+
| id | name    | gender | salary  | startdate  |
+----+---------+--------+---------+------------+
|  1 | Bill    | m      | 1000000 | 2018-01-03 |
|  2 | Terisa  | f      | 3000000 | 2019-11-13 |
|  3 | Charlie | m      | 3000000 | 2020-05-21 |
+----+---------+--------+---------+------------+
3 rows in set (0.00 sec)

/*
 *find sum, average, min, max and number of male and female employees
 */

mysql> select avg(salary) from employee_payroll
    -> where gender='m' group by gender;
+-------------+
| avg(salary) |
+-------------+
|     2000000 |
+-------------+
1 row in set (0.00 sec)

mysql> select avg(salary) from employee_payroll			#average of salary by grouping of gender
    ->  group by gender;
+-------------+
| avg(salary) |
+-------------+
|     2000000 |
|     3000000 |
+-------------+
2 rows in set (0.00 sec)

mysql> select gender, avg(salary) from employee_payroll group by gender;	
+--------+-------------+
| gender | avg(salary) |
+--------+-------------+
| m      |     2000000 |
| f      |     3000000 |
+--------+-------------+
2 rows in set (0.00 sec)

mysql> select  gender, count(salary) from employee_payroll group by gender;
+--------+---------------+
| gender | count(salary) |
+--------+---------------+
| m      |             2 |
| f      |             1 |
+--------+---------------+
2 rows in set (0.00 sec)

mysql> select name, gender, min(salary) from employee_payroll;
+------+--------+-------------+
| name | gender | min(salary) |
+------+--------+-------------+
| Bill | m      |     1000000 |
+------+--------+-------------+
1 row in set (0.00 sec)

/*
 *create new column and Update the values in the employee_Payroll table
 */
 
mysql> alter table Employee_Payroll add PhoneNumber varchar(20);
Query OK, 0 rows affected (0.08 sec)
Records: 0  Duplicates: 0  Warnings: 0

mysql> alter table Employee_Payroll add Address varchar(20);
Query OK, 0 rows affected (0.01 sec)
Records: 0  Duplicates: 0  Warnings: 0

mysql> alter table Employee_Payroll add Department varchar(20);
Query OK, 0 rows affected (0.01 sec)
Records: 0  Duplicates: 0  Warnings: 0

mysql> select * from employee_Payroll;
+----+---------+--------+---------+------------+-------------+---------+------------+
| Id | Name    | gender | Salary  | StartDate  | PhoneNumber | Address | Department |
+----+---------+--------+---------+------------+-------------+---------+------------+
|  1 | Bill    | m      | 1000000 | 2018-01-03 | NULL        | NULL    | NULL       |
|  2 | Terisa  | f      | 2000000 | 2019-11-13 | NULL        | NULL    | NULL       |
|  3 | Charlie | m      | 3000000 | 2020-05-21 | NULL        | NULL    | NULL       |
+----+---------+--------+---------+------------+-------------+---------+------------+
3 rows in set (0.00 sec)

mysql> update employee_Payroll set PhoneNumber ='9172322399' where name ='Bill';
Query OK, 1 row affected (0.02 sec)
Rows matched: 1  Changed: 1  Warnings: 0

mysql> update employee_Payroll set PhoneNumber ='8626001571' where name ='Terish';
Query OK, 0 rows affected (0.00 sec)
Rows matched: 0  Changed: 0  Warnings: 0

mysql> update employee_Payroll set PhoneNumber ='9422101501' where name ='Charlie';
Query OK, 1 row affected (0.00 sec)
Rows matched: 1  Changed: 1  Warnings: 0

mysql> select * from employee_Payroll;
+----+---------+--------+---------+------------+-------------+---------+------------+
| Id | Name    | gender | Salary  | StartDate  | PhoneNumber | Address | Department |
+----+---------+--------+---------+------------+-------------+---------+------------+
|  1 | Bill    | m      | 1000000 | 2018-01-03 | 9172322399  | NULL    | NULL       |
|  2 | Terisa  | f      | 2000000 | 2019-11-13 | NULL        | NULL    | NULL       |
|  3 | Charlie | m      | 3000000 | 2020-05-21 | 9422101501  | NULL    | NULL       |
+----+---------+--------+---------+------------+-------------+---------+------------+
3 rows in set (0.00 sec)

mysql> update employee_Payroll set Address ='pune' where name ='Bill';
Query OK, 1 row affected (0.00 sec)
Rows matched: 1  Changed: 1  Warnings: 0

mysql> update employee_Payroll set Address ='Banglore' where name ='Terisa';
Query OK, 1 row affected (0.00 sec)
Rows matched: 1  Changed: 1  Warnings: 0

mysql> update employee_Payroll set Address ='Hubli' where name ='Charlie';
Query OK, 1 row affected (0.00 sec)
Rows matched: 1  Changed: 1  Warnings: 0

mysql> select * from employee_Payroll;
+----+---------+--------+---------+------------+-------------+----------+------------+
| Id | Name    | gender | Salary  | StartDate  | PhoneNumber | Address  | Department |
+----+---------+--------+---------+------------+-------------+----------+------------+
|  1 | Bill    | m      | 1000000 | 2018-01-03 | 9172322399  | pune     | NULL       |
|  2 | Terisa  | f      | 2000000 | 2019-11-13 | NULL        | Banglore | NULL       |
|  3 | Charlie | m      | 3000000 | 2020-05-21 | 9422101501  | Hubli    | NULL       |
+----+---------+--------+---------+------------+-------------+----------+------------+
3 rows in set (0.00 sec)

mysql> update employee_Payroll set Department ='Admin' where name ='Bill';
Query OK, 1 row affected (0.00 sec)
Rows matched: 1  Changed: 1  Warnings: 0

mysql> update employee_Payroll set Department ='Tech' where name ='Terisa';
Query OK, 1 row affected (0.00 sec)
Rows matched: 1  Changed: 1  Warnings: 0

mysql> update employee_Payroll set Department ='Store' where name ='Charlie';
Query OK, 1 row affected (0.00 sec)
Rows matched: 1  Changed: 1  Warnings: 0

mysql> select * from employee_Payroll;
+----+---------+--------+---------+------------+-------------+----------+------------+
| Id | Name    | gender | Salary  | StartDate  | PhoneNumber | Address  | Department |
+----+---------+--------+---------+------------+-------------+----------+------------+
|  1 | Bill    | m      | 1000000 | 2018-01-03 | 9172322399  | pune     | Admin      |
|  2 | Terisa  | f      | 2000000 | 2019-11-13 | NULL        | Banglore | Tech       |
|  3 | Charlie | m      | 3000000 | 2020-05-21 | 9422101501  | Hubli    | Store      |
+----+---------+--------+---------+------------+-------------+----------+------------+
3 rows in set (0.00 sec)

mysql>
